{
  "domain": "health",
  "version": "1.0.0",
  "lastUpdated": "2026-04-13",
  "description": "Design system regulations for health and medical applications, encompassing HIPAA compliance, FDA guidelines, clinical safety requirements, WCAG accessibility, and patient-centered design principles.",
  "references": [
    {
      "name": "HIPAA Privacy Rule",
      "url": "https://www.hhs.gov/hipaa/for-professionals/privacy/index.html",
      "description": "Health Insurance Portability and Accountability Act requirements for protecting patient health information."
    },
    {
      "name": "FDA Mobile Medical Applications Guidance",
      "url": "https://www.fda.gov/medical-devices/digital-health-center-excellence/device-software-functions-including-mobile-medical-applications",
      "description": "FDA guidance on the regulation of mobile medical applications."
    },
    {
      "name": "WCAG 2.1 Level AA",
      "url": "https://www.w3.org/TR/WCAG21/",
      "description": "Web Content Accessibility Guidelines, especially important for health applications serving diverse populations."
    },
    {
      "name": "IEC 62366 Usability Engineering",
      "url": "https://www.iso.org/standard/63179.html",
      "description": "International standard for usability engineering of medical devices."
    },
    {
      "name": "Section 508",
      "url": "https://www.section508.gov/",
      "description": "Federal accessibility requirements applicable to health IT systems."
    }
  ],
  "regulations": [
    {
      "id": "HLT-001",
      "category": "compliance",
      "title": "HIPAA UI Compliance",
      "description": "User interfaces must enforce HIPAA requirements for the display, transmission, and storage of Protected Health Information (PHI).",
      "severity": "mandatory",
      "rules": [
        {
          "id": "HLT-001-01",
          "description": "PHI display controls",
          "requirement": "PHI must be masked or hidden by default on screen. Users must perform an explicit action (tap to reveal, authentication) to view full PHI. Partial masking (showing last 4 digits of MRN) is acceptable for identification.",
          "rationale": "PHI displayed openly on screen can be exposed through shoulder surfing, screen sharing, or screenshots."
        },
        {
          "id": "HLT-001-02",
          "description": "Session timeout display",
          "requirement": "Applications must display a visible countdown or warning at least 30 seconds before an automatic session timeout occurs, giving users the option to extend their session.",
          "value": 30,
          "unit": "seconds",
          "rationale": "Healthcare professionals need time to save work before HIPAA-mandated session expiration."
        },
        {
          "id": "HLT-001-03",
          "description": "Audit trail visibility",
          "requirement": "Applications must provide a user-accessible audit log showing who accessed a patient record and when, meeting HIPAA's minimum necessary standard.",
          "rationale": "HIPAA requires accounting of disclosures and access auditing for PHI."
        },
        {
          "id": "HLT-001-04",
          "description": "Screen capture prevention",
          "requirement": "Screens displaying PHI must prevent or warn about screen capture. On mobile, FLAG_SECURE (Android) or screen recording notifications (iOS) must be implemented.",
          "rationale": "Screen captures of PHI create unencrypted copies that violate HIPAA safeguards."
        }
      ],
      "tags": ["hipaa", "phi", "compliance", "security"],
      "references": [
        {
          "name": "HIPAA Security Rule",
          "url": "https://www.hhs.gov/hipaa/for-professionals/security/index.html"
        }
      ]
    },
    {
      "id": "HLT-002",
      "category": "safety",
      "title": "Clinical Safety UI Standards",
      "description": "User interfaces for clinical workflows must minimize the risk of patient harm through clear, unambiguous design.",
      "severity": "mandatory",
      "rules": [
        {
          "id": "HLT-002-01",
          "description": "Critical value highlighting",
          "requirement": "Abnormal or critical lab values, vital signs, and medication alerts must be visually distinct using both color and iconography (e.g., red background plus warning icon). Critical values must use a minimum text size of 18sp/pt.",
          "value": 18,
          "unit": "sp",
          "rationale": "Missed critical values can lead to delayed treatment and patient harm."
        },
        {
          "id": "HLT-002-02",
          "description": "Medication name display",
          "requirement": "Medication names must use Tall Man lettering (e.g., DOBUTamine vs DOPamine) to differentiate look-alike/sound-alike (LASA) drug names. Generic and brand names must both be displayed.",
          "rationale": "ISMP and FDA recommend Tall Man lettering to reduce medication errors from name confusion."
        },
        {
          "id": "HLT-002-03",
          "description": "Dosage input validation",
          "requirement": "Dosage input fields must enforce range limits, display the unit of measurement alongside the input, and require explicit confirmation for values exceeding typical ranges.",
          "rationale": "Incorrect dosage entry is a leading cause of medication errors in health IT systems."
        },
        {
          "id": "HLT-002-04",
          "description": "Confirmation for irreversible actions",
          "requirement": "Irreversible clinical actions (medication administration, order signing, discharge) must require a two-step confirmation with a clear summary of the action being taken.",
          "rationale": "Single-tap irreversible actions in clinical contexts can result in patient safety incidents."
        },
        {
          "id": "HLT-002-05",
          "description": "Patient identification display",
          "requirement": "Every clinical screen must display at least two patient identifiers (name plus date of birth, or name plus MRN) in a fixed, prominent location to prevent wrong-patient errors.",
          "rationale": "The Joint Commission's National Patient Safety Goals require two-identifier verification."
        }
      ],
      "tags": ["clinical-safety", "patient-safety", "medications", "lasa"],
      "references": [
        {
          "name": "ISMP Tall Man Lettering",
          "url": "https://www.ismp.org/recommendations/tall-man-letters-list"
        },
        {
          "name": "Joint Commission Patient Safety Goals",
          "url": "https://www.jointcommission.org/standards/national-patient-safety-goals/"
        }
      ]
    },
    {
      "id": "HLT-003",
      "category": "accessibility",
      "title": "Health Application Accessibility",
      "description": "Health applications must exceed standard accessibility requirements due to the critical nature of health information and the diverse needs of patient populations.",
      "severity": "mandatory",
      "rules": [
        {
          "id": "HLT-003-01",
          "description": "Enhanced contrast requirement",
          "requirement": "Text contrast must meet WCAG 2.1 Level AAA (7:1 for normal text, 4.5:1 for large text) for all clinical data displays.",
          "value": 7,
          "unit": "ratio",
          "rationale": "Clinical environments often have suboptimal lighting, and users may have impaired vision."
        },
        {
          "id": "HLT-003-02",
          "description": "Minimum clinical text size",
          "requirement": "Clinical data text (vitals, lab results, medication names) must be at least 16sp/pt at default scale and must support user scaling up to 300%.",
          "value": 16,
          "unit": "sp",
          "rationale": "Healthcare workers may read screens at a distance or under stress; larger text reduces errors."
        },
        {
          "id": "HLT-003-03",
          "description": "Screen reader optimization",
          "requirement": "All clinical data must be properly structured for screen readers with logical grouping, meaningful labels, and correct reading order. Tabular data must use proper table semantics.",
          "rationale": "Healthcare professionals and patients with visual impairments must be able to access health data."
        },
        {
          "id": "HLT-003-04",
          "description": "Multilingual support",
          "requirement": "Patient-facing health applications must support at minimum English and Spanish, with the ability to add additional languages. Medical terminology must be available in plain language.",
          "rationale": "Limited English proficiency is a significant barrier to healthcare access in the US."
        },
        {
          "id": "HLT-003-05",
          "description": "Cognitive accessibility",
          "requirement": "Health information must be presented at a maximum 6th-grade reading level for patient-facing content. Medical jargon must be supplemented with plain-language explanations.",
          "value": 6,
          "unit": "grade-level",
          "rationale": "Average US health literacy is at the 7th-8th grade level; targeting 6th grade ensures broader comprehension."
        }
      ],
      "tags": ["accessibility", "wcag-aaa", "health-literacy", "multilingual"],
      "references": [
        {
          "name": "Section 508 Standards",
          "url": "https://www.section508.gov/"
        },
        {
          "name": "CDC Health Literacy Resources",
          "url": "https://www.cdc.gov/healthliteracy/"
        }
      ]
    },
    {
      "id": "HLT-004",
      "category": "data-display",
      "title": "Clinical Data Visualization",
      "description": "Clinical data must be presented in clear, accurate, and standardized formats to support safe clinical decision-making.",
      "severity": "mandatory",
      "rules": [
        {
          "id": "HLT-004-01",